{"$schemaId":"https://schemas.cp6.dev/release/pinned-nuget-trust-store.v1","allowedPackageIds":["CP6.Platform.Abstractions","CP6.Platform.AspNetCore","CP6.Platform.Contracts","CP6.Platform.Deployment","CP6.Platform.EntityFramework","CP6.Platform.Messaging","CP6.Platform.Release"],"internallyTrusted":true,"policyVersion":2,"publicCaTrusted":false,"signers":[{"activatedAtUtc":"2026-10-12T12:45:54.000Z","certificatePath":"certificates/5a45dfec788bf6bab98807f81e5c454c1bc6b08ccf7ea8bf5310af28fe490386.cer","certificateSha256":"5a45dfec788bf6bab98807f81e5c454c1bc6b08ccf7ea8bf5310af28fe490386","issuer":"CN=CP6 Platform Release Signing","revocationReason":null,"revokedAtUtc":null,"spkiKeyId":"sha256:0e8e72c244d24df47bc136ba1e4d204236ee4493b5064eddf104daaf299b0937","status":"Current","subject":"CN=CP6 Platform Release Signing","validFromUtc":"2026-10-12T12:40:54.000Z","validUntilUtc":"2027-10-13T12:40:54.000Z"},{"activatedAtUtc":"2026-09-03T05:01:13.371Z","certificatePath":"certificates/1debfb8ff286ea51192b7f259d1ac823c105c4188eac40148598d37f0e20ff0d.cer","certificateSha256":"1debfb8ff286ea51192b7f259d1ac823c105c4188eac40148598d37f0e20ff0d","issuer":"CN=CP6 Platform Release Signing","revocationReason":null,"revokedAtUtc":null,"spkiKeyId":"sha256:27ecc2239a1b3c2368610d3602aadc5260b44e26baffe896b9a2449662c696d6","status":"Historical","subject":"CN=CP6 Platform Release Signing","validFromUtc":"2026-09-03T04:56:13.000Z","validUntilUtc":"2028-09-02T05:01:13.000Z"}],"timestampPolicy":"Rfc3161Required","timestampService":"http://timestamp.digicert.com","trustModel":"PinnedSelfSigned"}