{"$schemaId":"https://schemas.cp6.dev/release/pinned-nuget-trust-store.v1","allowedPackageIds":["CP6.Platform.Abstractions","CP6.Platform.AspNetCore","CP6.Platform.Contracts","CP6.Platform.Deployment","CP6.Platform.EntityFramework","CP6.Platform.Messaging","CP6.Platform.Release"],"internallyTrusted":true,"policyVersion":2,"publicCaTrusted":false,"signers":[{"activatedAtUtc":"2026-10-12T12:46:53.000Z","certificatePath":"certificates/4dbdcbb1fcf058de9494122a5ff9a25a7b5cd6697363d5cebe50ef19223b45f2.cer","certificateSha256":"4dbdcbb1fcf058de9494122a5ff9a25a7b5cd6697363d5cebe50ef19223b45f2","issuer":"CN=CP6 Platform Release Signing","revocationReason":null,"revokedAtUtc":null,"spkiKeyId":"sha256:3f5f0465db8e7824bf7af4d33845192319d2d3958496ba7dd2fe432c71eaeb4f","status":"Current","subject":"CN=CP6 Platform Release Signing","validFromUtc":"2026-10-12T12:41:53.000Z","validUntilUtc":"2027-10-13T12:41:53.000Z"},{"activatedAtUtc":"2026-09-03T05:01:13.371Z","certificatePath":"certificates/1debfb8ff286ea51192b7f259d1ac823c105c4188eac40148598d37f0e20ff0d.cer","certificateSha256":"1debfb8ff286ea51192b7f259d1ac823c105c4188eac40148598d37f0e20ff0d","issuer":"CN=CP6 Platform Release Signing","revocationReason":"WP02-27 synthetic negative fixture; original policy unchanged","revokedAtUtc":"2026-10-13T11:41:53.979Z","spkiKeyId":"sha256:27ecc2239a1b3c2368610d3602aadc5260b44e26baffe896b9a2449662c696d6","status":"Revoked","subject":"CN=CP6 Platform Release Signing","validFromUtc":"2026-09-03T04:56:13.000Z","validUntilUtc":"2028-09-02T05:01:13.000Z"}],"timestampPolicy":"Rfc3161Required","timestampService":"http://timestamp.digicert.com","trustModel":"PinnedSelfSigned"}