{"$schemaId":"https://schemas.cp6.dev/release/pinned-nuget-trust-store.v1","allowedPackageIds":["CP6.Platform.Abstractions","CP6.Platform.AspNetCore","CP6.Platform.Contracts","CP6.Platform.Deployment","CP6.Platform.EntityFramework","CP6.Platform.Messaging","CP6.Platform.Release"],"internallyTrusted":true,"policyVersion":2,"publicCaTrusted":false,"signers":[{"activatedAtUtc":"2026-10-12T12:05:00.000Z","certificatePath":"certificates/39586664feb087c319bd07652b7d159876198ac036e367b244cf01345b7294dd.cer","certificateSha256":"39586664feb087c319bd07652b7d159876198ac036e367b244cf01345b7294dd","issuer":"CN=CP6 Platform Release Signing","revocationReason":null,"revokedAtUtc":null,"spkiKeyId":"sha256:1b7b2f9dcb4980bf59da2beffbd18d589cb5029769ef400695db1bb23c52150c","status":"Current","subject":"CN=CP6 Platform Release Signing","validFromUtc":"2026-10-12T12:00:00.000Z","validUntilUtc":"2027-10-13T12:00:00.000Z"}],"timestampPolicy":"Rfc3161Required","timestampService":"http://timestamp.digicert.com","trustModel":"PinnedSelfSigned"}